{
  "attestation_hash": "7d49750044135647f4196183de12b0bf2b53f2ff502c2167cd1be40f43cc87c0",
  "auditor_id": "AUD-C02",
  "declaration": "I was not supplied an expected touch set, expected freeze signature or K vector, expected classification, desired experiment outcome, or manuscript claim. I made these judgments solely from the contents of the sealed blind packet.",
  "isolation": {
    "fresh_context": true,
    "no_prior_experiment_context": true,
    "other_outputs_unavailable": true
  },
  "packet_sha256": "fbd22e2c706402c7dd8b4461f7dfaa860fb656ff49f48f10c80d6443b6fc3b1c",
  "prompt_sha256": "4ec4f9b6e21794f8068d225bf7b6825c8ab3f3a4ca1b43161fef504b08dcbdf3",
  "qualification": "COLD_MODEL_INDEPENDENT",
  "verdict_id": "AUD-C02-verdict",
  "verdicts": {
    "Atom": {
      "locators": [
        "corpus/xacml-3.0-core-spec-cos01-en.html Glossary PDP/PEP/Context-handler/Context (verified stripped 1000-1020 via candidates/locator_map.json)",
        "corpus/xacml-3.0-core-spec-cos01-en.html Sec. 3.1 dataflow (verified stripped 1732-1792)",
        "corpus/xacml-3.0-core-spec-cos01-en.html Sec. 5.57-5.58 StatusDetail/MissingAttributeDetail (verified stripped 7901-7985)",
        "corpus/xacml-3.0-core-spec-cos01-en.html Sec. 7.17 Authorization decision (verified stripped 9260-9280) + Sec. 7.3.5 (verified stripped 8405-8432, bags immutable)",
        "corpus/fixture/request.xml:1-19 + corpus/fixture/response.xml:1-14 (Indeterminate/missing-attribute + MissingAttributeDetail triple) + corpus/fixture/policies/policy.xml:18-20 (matching MustBePresent=true designator) + corpus/fixture/pdp.xml:6-8 (StaticPolicyProvider PARENT_DIR glob)",
        "candidates/builder_source.py:82-94 (read_missing_detail) + :97-112 (read_policy_designators MustBePresent check) + :120-168 (INV-05 single-Attribute addition + residual) + :170-193 (insert_attribute subject-only, value-level DataType only) + :42-56,:221,:265 (out_dir disjoint pre/post-create) + :204-274 (main two-world build + INV-06)",
        "candidates/repaired_request_x_permit.xml + candidates/repaired_request_x_nonpermit.xml + candidates/request_diffs.json:10-11 (unified diffs: one inserted subject Attribute each; declaration-quote/attr-order/empty-element deltas; c14n hashes)",
        "candidates/wrapper_evidence.json:48-81 (import roots copy/os/sys/lxml only, builder_reaches_pdp false, zero forbidden-token hits) corroborated by direct inspection of candidates/builder_source.py bytes (sha256 f732a08a37047550f9c067c761e0ab154ca699ee5d0eb9bb516a48f99c0986ea)"
      ],
      "notes": "Native PEP->handler-context->PDP->response->PEP boundary is fixed by glossary/dataflow/7.17 plus the frozen original request/response pair. Wrapper separation is proven by in-packet builder bytes (static triple read from response + policy cross-check, subject-category pin, single-Attribute insert, INV-05/INV-06, disjointness, no PDP/socket/subprocess imports or calls) plus repaired bytes/diffs showing c14n-identity except one inserted Attribute and triple byte-equality across response/policy/builder. Counting (one native cycle per world; wrapper is pre-step) and pre/post checkpoints delimiting the measured interval follow from that decomposition. Staging-copy and ps1-gating details cite files absent from the packet manifest; that absence fails blind verifiability of those ancillary subclaims per supplement rule 2 but is immaterial to the core native-vs-reconstruction distinction, which is established by construction from in-packet bytes. No native cycle conflated with wrapper pre-step.",
      "status": "FIXED"
    },
    "H": {
      "locators": [
        "corpus/fixture/request.xml:3-18 (subject-id present; some-attribute absent; empty environment Attributes container line 18)",
        "corpus/fixture/policies/policy.xml:14-43 (5 AttributeDesignators, all MustBePresent=true, zero Issuer, zero environment-category designators, functions string-equal/anyURI-equal only)",
        "corpus/fixture/response.xml:9-10 (MissingAttributeDetail triple: some-attribute/access-subject/xsd:string)",
        "corpus/xacml-3.0-core-spec-cos01-en.html Sec. 7.3.4 Attribute Matching (verified stripped 8381-8404; Issuer-absent rule 8398-8401 via candidates/locator_map.json)",
        "corpus/xacml-3.0-core-spec-cos01-en.html Sec. 7.3.5 Attribute Retrieval (verified stripped 8405-8432: missing vs empty-bag vs Indeterminate, MustBePresent true/false, bags immutable)",
        "corpus/xacml-3.0-core-spec-cos01-en.html Sec. 5.29 AttributeDesignator (verified stripped 6282-6300: bag of matched values)",
        "corpus/xacml-3.0-core-spec-cos01-en.html Sec. 10.2.5 (verified stripped 10700-10730: current-time/date/dateTime MUST-supply) + Sec. 7.3.6 (verified stripped 8434-8441)",
        "n4_excerpts/xsd_std_providers.txt + n4_excerpts/stdenv_default_factory.txt + n4_excerpts/stdenv_default_doc.txt + n4_excerpts/xsd_stdenv_doc.txt (standard provider enabled override=false, serves current-* only)"
      ],
      "notes": "Multimap key (Category,AttributeId,DataType,Issuer-or-null) follows 7.3.4+7.3.5+5.29; Issuer-or-null finer than PDP matching with no divergence here proven by zero-Issuer census across original plus both completed requests and the 8398-8401 wildcard rule. absent_required single coordinate follows from request absence + universal MustBePresent=true + response triple byte-equality. empty_categories explicit recording matches the empty environment element in request bytes. Environment authorization-inertness follows from zero env designators, zero time functions, zero env values supplied, and sole addition channel serving current-* only. C14N/sorted-bag canonicalization is definitional and consistent with Bag unordered semantics. No contradiction found.",
      "status": "FIXED"
    },
    "Lambda": {
      "locators": [
        "corpus/fixture/policies/policy.xml (sha256 8475166ce0a38dabdcddb0a41189893e5546fbbe72a9a27e8f547a0be204fe64 matches lambda policy_bytes)",
        "corpus/COMMIT.txt (3cc0e988e1639da48184434cd5c918102ff5b499) + corpus/RELEASE.json (release-21.2.0) matches lambda implementation_identity",
        "corpus/fixture/pdp.xml:6-8 (StaticPolicyProvider PARENT_DIR glob) + n4_excerpts/parent_dir.txt (PARENT_DIR semantics) + candidates/policy_dir_listing.json (single-member policies dir)",
        "n4_excerpts/xsd_std_providers.txt (standardAttributeProvidersEnabled default true) + n4_excerpts/xsd_strict_issuer.txt (strictAttributeIssuerMatch default false) + n4_excerpts/xsd_preprocessor_defaults.txt + n4_excerpts/adapter_defaults.txt (default-lax LaxVariantFactory) + n4_excerpts/std_wiring.txt + n4_excerpts/stdenv_default_factory.txt (DEFAULT_FACTORY override false) + n4_excerpts/xsd_stdenv_doc.txt",
        "candidates/lambda_manifest.json pre_hash 3e8cf8ffba078c54c25867cb3aa2e0c232165bbded136efb2a3f58407f4e221a recomputes blind via UTF-8 sorted-keys JSON of components+exclusions; candidates/resolved_effective.json sha256 equals exclusions.resolved_defaults sha256 62bc5f920879c22d08dda611ec31ffd0f33ecfeaccf748046366598b74301e67; components.provider_element sha256 73ebcf1d3013892f6323b709ae9255e4b5aceb2fd5a17e7c2e5a361c25d0dbe5 recomputes blind via exclusive C14N of pdp.xml policyProvider element"
      ],
      "notes": "Material gap: components.engine_sources five file hashes have no in-packet bytes, no per-component hashing method stated, and the packet manifest lists no engine files, derive script, or invocation scripts; exclusions.policy_location sha256 3560d67298def4d74418ead1c9b0d070b216792c25fbfa3ad7c4900ce98d3865 states no method/inputs; lambda_deferral post_hash enforcement cites Phase-3 derivation code absent from the manifest. Per rubric supplement rules 1-2 this fails blind verifiability of those components (not necessarily their truth). Pre_hash itself is reconstructible but inherits unverifiable inputs. Substantial partial support exists and no contradiction was found, hence PARTIAL, not AMBIGUOUS or UNSUPPORTED.",
      "status": "PARTIAL"
    },
    "P_R": {
      "locators": [
        "corpus/fixture/policies/policy.xml:14-43 (5 Match occurrences projecting to 4 coordinates; action-id coordinate carries read/write literals lines 34-43; all MustBePresent=true; zero Issuer)",
        "corpus/xacml-3.0-core-spec-cos01-en.html Sec. 7.6 Match evaluation (verified stripped 8569-8600: operational-error=>Indeterminate, empty-bag=>False, existential True/else Indeterminate/else False)",
        "corpus/xacml-3.0-core-spec-cos01-en.html Sec. 7.3.5 (verified stripped 8405-8432: missing+MustBePresent false=>empty bag, true=>Indeterminate)",
        "corpus/xacml-3.0-core-spec-cos01-en.html Sec. 7.3.4 (verified stripped 8381-8404: Issuer-absent wildcard)",
        "corpus/xacml-3.0-core-spec-cos01-en.html Sec. 7.7 Target evaluation (verified stripped 8691-8710)",
        "corpus/fixture/request.xml:3-18 + corpus/fixture/response.xml:9-10 (singleton present bags; single missing-able coordinate; empty-bag state unreachable on admitted histories)"
      ],
      "notes": "Match-vector TRUE/FALSE/INDETERMINATE rule follows 7.6+7.3.5: present-match=>True, present-nonmatch=>False, missing+MustBePresent true=>Indeterminate via designator error propagation; empty=>False is moot here (all MustBePresent true, singleton or missing discretely). 5-to-4 dedup verified in policy bytes (action bag held once, evaluated twice). Interface-scoped coincidence of Match-vector equality with sorted bag identity follows from singleton bags, Issuer null throughout, and exact datatypes, all censused from frozen bytes; generality beyond that interface is expressly disclaimed. No per-world outcomes used.",
      "status": "FIXED"
    }
  }
}
