{
  "attestation_hash": "88968de01d38538f2b2ff7012b377584821c1ab2ea4b8fc41e22a18ec96a07bc",
  "auditor_id": "AUD-C04",
  "declaration": "I was not supplied an expected touch set, expected freeze signature or K vector, expected classification, desired experiment outcome, or manuscript claim. I made these judgments solely from the contents of the sealed blind packet.",
  "isolation": {
    "fresh_context": true,
    "no_prior_experiment_context": true,
    "other_outputs_unavailable": true
  },
  "packet_sha256": "156e36d75627d2aa746026a9689e1d3f3f293b51b5104e16a60ea3f29bdc255e",
  "prompt_sha256": "4ec4f9b6e21794f8068d225bf7b6825c8ab3f3a4ca1b43161fef504b08dcbdf3",
  "qualification": "COLD_MODEL_INDEPENDENT",
  "verdict_id": "AUD-C04-verdict",
  "verdicts": {
    "Atom": {
      "locators": [
        "corpus/fixture/request.xml:1-19",
        "corpus/fixture/response.xml:1-14",
        "corpus/xacml-3.0-core-spec-cos01-en.html:Sec.3.1 stripped-text lines 1755-1785",
        "candidates/builder_source.py:82-193",
        "candidates/repaired_request_x_permit.xml:1-19 and candidates/repaired_request_x_nonpermit.xml",
        "candidates/request_diffs.json:10-11 and c14n_sha256",
        "candidates/wrapper_evidence.json:104-165 rule_to_code and builder_reaches_pdp false",
        "candidates/invocation_record.json:2-11 and candidates/execution_inputs.json"
      ],
      "notes": "Native request/response transaction distinguished from experiment-authored reconstruction. Native boundary per Sec.3.1 with corpus request/response/pdp/policy; wrapper copies original and inserts exactly one subject Attribute before submission with no authorization logic and no PDP output consumed. c14n-identity with one insertion verified via diffs and recomputed c14n; MissingAttributeDetail triple byte-equal across response Detail, policy MustBePresent-true designator and builder INV-05 residual; out_dir disjointness enforced pre/post-create plus gate; pre/post checkpoints delimit measured interval, not a single PDP cycle.",
      "status": "FIXED"
    },
    "H": {
      "locators": [
        "corpus/fixture/request.xml:3-18",
        "corpus/fixture/response.xml:9-10",
        "corpus/fixture/policies/policy.xml:14-43",
        "corpus/xacml-3.0-core-spec-cos01-en.html:Sec.7.3.4 stripped-text lines 8394-8401",
        "corpus/xacml-3.0-core-spec-cos01-en.html:Sec.7.3.5 stripped-text lines 8419-8433",
        "candidates/admitted_value_census.json",
        "n4_excerpts/xsd_std_providers.txt:7-20"
      ],
      "notes": "Multimap keyed by Category/AttributeId/DataType/Issuer-or-null, absent_required triple, empty environment category, env-inert scope, Issuer-absent rule and C14N canonicalization each grounded in corpus fixtures, XACML Sec.7.3.4/7.3.5 and N4 defaults plus mechanical censuses. No alternate invented.",
      "status": "FIXED"
    },
    "Lambda": {
      "locators": [
        "candidates/lambda_manifest.json:components+exclusions pre_hash d4a5fcd891910184c8d7919ab44395cbf6c1860de95bf8d5ba098b68d757a00b recomputed per stated canonicalization",
        "candidates/engine_sources/pdp-engine/src/main/java/org/ow2/authzforce/core/pdp/impl/StandardEnvironmentAttributeProvider.java representative of 76 hash-verified files",
        "corpus/fixture/policies/policy.xml sha 8475166ce0a38dabdcddb0a41189893e5546fbbe72a9a27e8f547a0be204fe64",
        "candidates/resolved_effective.json sha 62bc5f920879c22d08dda611ec31ffd0f33ecfeaccf748046366598b74301e67",
        "candidates/policy_dir_listing.json sha 78fbb6191ed8a460e864a6aecb920d3d7d8d636fafb8025e2a11d2d465198815",
        "PACKET_MANIFEST.json:file-list absence of src/xacml/PdpRunner.java, pdp-engine/target/*.jar, pom.xml",
        "candidates/pre_hash_lineage.json:2-5 current 3e8cf8ffba078c54c25867cb3aa2e0c232165bbded136efb2a3f58407f4e221a"
      ],
      "notes": "Partial support with material gap. Pre_hash recomputes and engine-semantic-set, policy bytes, provider c14n, classpath manifest, resolved defaults and dir listing verify in-packet. Gap 1: built_artifacts drivers/jars/poms state method and inputs but bytes are absent from packet file list and frozen external seals, failing rubric-supplement R1 blind verifiability; limitation disclosed but not cured. Gap 2: pre_hash_lineage current 3e8cf8ff contradicts operative manifest pre_hash d4a5fcd8, violating its own single-operative rule. Post_hash deferral is honest with 0 executions and enforced criterion.",
      "status": "PARTIAL"
    },
    "P_R": {
      "locators": [
        "corpus/fixture/policies/policy.xml:14-43 and 34-43",
        "candidates/match_table.json:2-68",
        "corpus/xacml-3.0-core-spec-cos01-en.html:Sec.7.3.5 stripped-text lines 8419-8423",
        "corpus/xacml-3.0-core-spec-cos01-en.html:Sec.7.6 stripped-text lines 8604-8617",
        "corpus/xacml-3.0-core-spec-cos01-en.html:Sec.7.3.4 stripped-text lines 8394-8401"
      ],
      "notes": "5 occurrences project to 4 coordinates with action-id duplicated and evaluated twice; Match-vector TRUE/FALSE/INDETERMINATE and missing-plus-MustBePresent-true as Indeterminate follow Sec.7.6/7.3.5; singleton null-Issuer coincidence scoped to admitted histories and evidenced via match table, not assumed; Issuer pooling immaterial per Sec.7.3.4.",
      "status": "FIXED"
    }
  }
}
